[
  {
    "id": "js",
    "label": "Backend JavaScript",
    "intro": "Backend modules call actions through a small client. It adds the bearer token bound to the logged-in user, so a session cookie alone is never enough.",
    "snippets": [
      {
        "language": "javascript",
        "code": "import { action } from '@typo3/core/action/request.js';\n\nconst response = await action('/my-extension/page/{uid}/titles', { uid: '42' }).get();\nconst titles = await response.resolve();"
      }
    ]
  },
  {
    "id": "http",
    "label": "HTTP API",
    "intro": "External applications use the same endpoint with a token from EXT:hub. Declared errors arrive with their status code.",
    "snippets": [
      {
        "language": "shell",
        "code": "curl -H 'Authorization: Bearer <token>' \\\n    https://example.org/typo3/api/my-extension/page/42/titles\n\n# 200 OK\n[\"Home\", \"Startseite\", \"Accueil\"]\n\n# 404 Not Found\n{\"error\": \"Page not found\"}"
      }
    ]
  },
  {
    "id": "openapi",
    "label": "OpenAPI",
    "intro": "Excerpt of the generated OpenAPI 3.1 document at `/typo3/api/schema`, shown in Swagger UI in the backend.",
    "snippets": [
      {
        "language": "yaml",
        "code": "/my-extension/page/{uid}/titles:\n  get:\n    summary: Fetch the titles of a page\n    security:\n      - oauth2: ['content:read']\n      - static: []\n      - beuser: []\n    parameters:\n      - { name: uid, in: path, required: true, schema: { type: integer } }\n    responses:\n      '200':\n        description: OK\n        content:\n          application/json:\n            schema: { type: array, items: { type: string } }\n      '404':\n        description: if the page does not exist"
      }
    ]
  },
  {
    "id": "mcp",
    "label": "MCP tool",
    "intro": "The same action in the MCP tool list (`tools/list`, abridged), and a call from an AI agent.",
    "snippets": [
      {
        "language": "json",
        "code": "{\n  \"name\": \"fetch_my_extension_page_by_uid_titles\",\n  \"title\": \"Fetch the titles of a page\",\n  \"inputSchema\": { \"type\": \"object\", \"properties\": { \"uid\": { \"type\": \"integer\" } }, \"required\": [\"uid\"] },\n  \"outputSchema\": { \"type\": \"object\", \"properties\": { \"data\": { \"type\": \"array\", \"items\": { \"type\": \"string\" } } } },\n  \"annotations\": { \"readOnlyHint\": true, \"destructiveHint\": false, \"idempotentHint\": false }\n}"
      },
      {
        "language": "json",
        "code": "// → POST /typo3/api/mcp\n{\"jsonrpc\": \"2.0\", \"id\": 3, \"method\": \"tools/call\",\n \"params\": {\"name\": \"fetch_my_extension_page_by_uid_titles\", \"arguments\": {\"uid\": 42}}}\n\n// ← 200 OK\n{\"jsonrpc\": \"2.0\", \"id\": 3, \"result\": {\"resultType\": \"complete\",\n \"structuredContent\": {\"data\": [\"Home\", \"Startseite\", \"Accueil\"]}, \"content\": []}}"
      }
    ]
  },
  {
    "id": "stdio",
    "label": "Local MCP (stdio)",
    "intro": "Coding agents on a developer machine start TYPO3 as a local MCP server. No web server and no EXT:hub are needed; the agent acts as the given backend user.",
    "snippets": [
      {
        "language": "json",
        "code": "{\n  \"mcpServers\": {\n    \"typo3\": {\n      \"command\": \"vendor/bin/typo3\",\n      \"args\": [\"mcp:serve\", \"--user=editor\"]\n    }\n  }\n}"
      }
    ]
  }
]
